{
  "$schema": "../event_envelope.schema.json",
  "eventId": "evt-20250101-abc123",
  "eventType": "ContentPages.PageCreated",
  "schemaId": "domain.contentpages.page.created.v1",
  "schemaVersion": 1,
  "occurredAt": "2025-01-01T12:00:00.000Z",
  "tenantId": "tenant-001",
  "principalId": "principal-user-123",
  "userId": "user-123",
  "correlationId": "corr-xyz789",
  "causationId": "evt-20250101-parent456",
  "idempotencyKey": "unique-key-page-create-001",
  "payload": {
    "pageId": "page-001",
    "slug": "welcome",
    "title": "Welcome Page",
    "status": "draft"
  }
}
